{
  "schemaVersion": 5,
  "id": "energy-hole",
  "name": "Energy PINN \u00b7 circular cutout",
  "revision": 0,
  "displayUnits": "m",
  "geometry": {
    "kind": "profile",
    "length": 4,
    "width": 4,
    "height": 0.1,
    "radius": 1,
    "thickness": 0.1,
    "profile": {
      "outer": [
        {
          "id": "y0",
          "name": "Bottom symmetry",
          "kind": "line",
          "start": [-4, 0],
          "end": [-1, 0]
        },
        {
          "id": "hole",
          "name": "Traction-free circular cutout",
          "kind": "arc",
          "start": [-1, 0],
          "end": [0, 1],
          "center": [0, 0],
          "clockwise": true
        },
        {
          "id": "x0",
          "name": "Vertical symmetry",
          "kind": "line",
          "start": [0, 1],
          "end": [0, 4]
        },
        {
          "id": "y1",
          "name": "Top outer edge",
          "kind": "line",
          "start": [0, 4],
          "end": [-4, 4]
        },
        {
          "id": "x1",
          "name": "Left outer edge",
          "kind": "line",
          "start": [-4, 4],
          "end": [-4, 0]
        }
      ],
      "holes": []
    }
  },
  "study": {
    "id": "energy-hole-study",
    "type": "linear-static",
    "material": {
      "name": "Authored SI elastic material",
      "young": 100000,
      "poisson": 0.3
    },
    "mesh": {
      "size": 0.4,
      "boundarySize": 0.15
    },
    "constraints": [
      {
        "id": "symmetry-y",
        "name": "Bottom symmetry \u00b7 uy = 0",
        "regions": ["y0"],
        "components": [null, 0, null]
      },
      {
        "id": "symmetry-x",
        "name": "Vertical symmetry \u00b7 ux = 0",
        "regions": ["x0"],
        "components": [0, null, null]
      }
    ],
    "loads": [
      {
        "id": "outer-traction",
        "name": "Kirsch outer traction \u00b7 remote X tension",
        "regions": ["x1", "y1"],
        "kind": "traction",
        "vector": [0, 0, 0],
        "pressure": 0,
        "traction": {
          "kind": "kirsch",
          "radius": 1,
          "center": [0, 0],
          "tension": 0.5
        }
      }
    ],
    "dimension": "2d",
    "formulation": "plane-stress",
    "thickness": 0.1,
    "solver": {
      "kind": "pinn",
      "pinn": {
        "layers": 2,
        "width": 16,
        "activation": "tanh",
        "optimizer": "adam",
        "learningRate": 0.001,
        "steps": 3000,
        "interiorPoints": 4096,
        "boundaryPoints": 64,
        "seed": 42,
        "device": "cpu",
        "formulation": "potential-energy"
      }
    }
  },
  "namedSelections": []
}
